{
  "$schema": "../anim-clip.schema.json",
  "id": "anim-humanoid-crouch-walk",
  "rig": "greybox-humanoid",
  "loop": true,
  "duration": 0.9,
  "notes": "Grey-box placeholder (mw-e02.6): a 2.2 m/s crouched walk, knees staying bent and short steps under a hunched back. Plays in place; the game lowers the pelvis while crouched.",
  "tracks": {
    "spine": [
      {
        "t": 0,
        "rot": [22, 0, 0]
      }
    ],
    "chest": [
      {
        "t": 0,
        "rot": [10, 0, 0]
      }
    ],
    "head": [
      {
        "t": 0,
        "rot": [-25, 0, 0]
      }
    ],
    "thigh-l": [
      {
        "t": 0.0,
        "rot": [70.0, 0, 0]
      },
      {
        "t": 0.1125,
        "rot": [85.56, 0, 0]
      },
      {
        "t": 0.225,
        "rot": [92.0, 0, 0]
      },
      {
        "t": 0.3375,
        "rot": [85.56, 0, 0]
      },
      {
        "t": 0.45,
        "rot": [70.0, 0, 0]
      },
      {
        "t": 0.5625,
        "rot": [54.44, 0, 0]
      },
      {
        "t": 0.675,
        "rot": [48.0, 0, 0]
      },
      {
        "t": 0.7875,
        "rot": [54.44, 0, 0]
      },
      {
        "t": 0.9,
        "rot": [70.0, 0, 0]
      }
    ],
    "thigh-r": [
      {
        "t": 0.0,
        "rot": [70.0, 0, 0]
      },
      {
        "t": 0.1125,
        "rot": [54.44, 0, 0]
      },
      {
        "t": 0.225,
        "rot": [48.0, 0, 0]
      },
      {
        "t": 0.3375,
        "rot": [54.44, 0, 0]
      },
      {
        "t": 0.45,
        "rot": [70.0, 0, 0]
      },
      {
        "t": 0.5625,
        "rot": [85.56, 0, 0]
      },
      {
        "t": 0.675,
        "rot": [92.0, 0, 0]
      },
      {
        "t": 0.7875,
        "rot": [85.56, 0, 0]
      },
      {
        "t": 0.9,
        "rot": [70.0, 0, 0]
      }
    ],
    "shin-l": [
      {
        "t": 0.0,
        "rot": [-95.0, 0, 0]
      },
      {
        "t": 0.1125,
        "rot": [-99.39, 0, 0]
      },
      {
        "t": 0.225,
        "rot": [-110.0, 0, 0]
      },
      {
        "t": 0.3375,
        "rot": [-120.61, 0, 0]
      },
      {
        "t": 0.45,
        "rot": [-125.0, 0, 0]
      },
      {
        "t": 0.5625,
        "rot": [-120.61, 0, 0]
      },
      {
        "t": 0.675,
        "rot": [-110.0, 0, 0]
      },
      {
        "t": 0.7875,
        "rot": [-99.39, 0, 0]
      },
      {
        "t": 0.9,
        "rot": [-95.0, 0, 0]
      }
    ],
    "shin-r": [
      {
        "t": 0.0,
        "rot": [-125.0, 0, 0]
      },
      {
        "t": 0.1125,
        "rot": [-120.61, 0, 0]
      },
      {
        "t": 0.225,
        "rot": [-110.0, 0, 0]
      },
      {
        "t": 0.3375,
        "rot": [-99.39, 0, 0]
      },
      {
        "t": 0.45,
        "rot": [-95.0, 0, 0]
      },
      {
        "t": 0.5625,
        "rot": [-99.39, 0, 0]
      },
      {
        "t": 0.675,
        "rot": [-110.0, 0, 0]
      },
      {
        "t": 0.7875,
        "rot": [-120.61, 0, 0]
      },
      {
        "t": 0.9,
        "rot": [-125.0, 0, 0]
      }
    ],
    "upper-arm-l": [
      {
        "t": 0,
        "rot": [20, 0, -10]
      }
    ],
    "upper-arm-r": [
      {
        "t": 0,
        "rot": [20, 0, 10]
      }
    ],
    "forearm-l": [
      {
        "t": 0,
        "rot": [40, 0, 0]
      }
    ],
    "forearm-r": [
      {
        "t": 0,
        "rot": [40, 0, 0]
      }
    ]
  },
  "markers": [
    {
      "kind": "footstep",
      "t": 0.225
    },
    {
      "kind": "footstep",
      "t": 0.675
    }
  ]
}
