{
  "$schema": "../anim-clip.schema.json",
  "id": "anim-forgotten-shield-counter",
  "rig": "greybox-humanoid",
  "notes": "The Forgotten shield-bearer's slow counter-swing (move forgotten-shield-counter, 38/5/36 ticks). PLACEHOLDER (mw-ju8.19): the miner's slash-1 clip retimed x2.111 so its hit marker lands on the move's first active tick (38); a bespoke clip is a follow-up.",
  "duration": 1.4075,
  "markers": [
    {
      "kind": "hit",
      "t": 0.6333
    }
  ],
  "tracks": {
    "spine": [
      {
        "t": 0.0,
        "rot": [0.0, 0.0, 0.0]
      },
      {
        "t": 0.285,
        "rot": [3.0, -6.0, 0.0]
      },
      {
        "t": 0.4117,
        "rot": [4.0, -8.0, 0.0]
      },
      {
        "t": 0.6333,
        "rot": [-5.0, 8.0, 0.0]
      },
      {
        "t": 0.8867,
        "rot": [-7.0, 14.0, 0.0]
      },
      {
        "t": 1.4075,
        "rot": [0.0, 0.0, 0.0]
      }
    ],
    "chest": [
      {
        "t": 0.0,
        "rot": [0.0, 0.0, 0.0]
      },
      {
        "t": 0.285,
        "rot": [6.0, -14.0, 0.0]
      },
      {
        "t": 0.4117,
        "rot": [8.0, -26.0, 0.0]
      },
      {
        "t": 0.6333,
        "rot": [-8.0, 20.0, 0.0]
      },
      {
        "t": 0.8867,
        "rot": [-10.0, 30.0, 0.0]
      },
      {
        "t": 1.4075,
        "rot": [0.0, 0.0, 0.0]
      }
    ],
    "upper-arm-r": [
      {
        "t": 0.0,
        "rot": [0.0, 0.0, 6.0]
      },
      {
        "t": 0.1267,
        "rot": [20.0, 0.0, 40.0]
      },
      {
        "t": 0.285,
        "rot": [60.0, -6.0, 48.0]
      },
      {
        "t": 0.4117,
        "rot": [118.0, -8.0, 20.0]
      },
      {
        "t": 0.6333,
        "rot": [82.0, -12.0, 6.0]
      },
      {
        "t": 0.8867,
        "rot": [35.0, -10.0, 2.0]
      },
      {
        "t": 1.4075,
        "rot": [0.0, 0.0, 6.0]
      }
    ],
    "forearm-r": [
      {
        "t": 0.0,
        "rot": [8.0, 0.0, 0.0]
      },
      {
        "t": 0.1267,
        "rot": [40.0, 0.0, 0.0]
      },
      {
        "t": 0.285,
        "rot": [80.0, 0.0, 0.0]
      },
      {
        "t": 0.4117,
        "rot": [100.0, 0.0, 0.0]
      },
      {
        "t": 0.6333,
        "rot": [15.0, 0.0, 0.0]
      },
      {
        "t": 0.8867,
        "rot": [10.0, 0.0, 0.0]
      },
      {
        "t": 1.4075,
        "rot": [8.0, 0.0, 0.0]
      }
    ],
    "upper-arm-l": [
      {
        "t": 0.0,
        "rot": [0.0, 0.0, -6.0]
      },
      {
        "t": 0.4117,
        "rot": [-22.0, 0.0, -14.0]
      },
      {
        "t": 0.6333,
        "rot": [25.0, 0.0, -22.0]
      },
      {
        "t": 1.4075,
        "rot": [0.0, 0.0, -6.0]
      }
    ]
  }
}
