{
  "$schema": "../anim-clip.schema.json",
  "id": "anim-forgotten-slash-2",
  "rig": "greybox-humanoid",
  "notes": "The Forgotten's backhand (18/4/24 ticks): a flat sweep from the left, as the knight's light 2.",
  "duration": 0.6333,
  "markers": [
    {
      "kind": "hit",
      "t": 0.3
    }
  ],
  "tracks": {
    "spine": [
      {
        "t": 0.0,
        "rot": [0.0, 0.0, 0.0]
      },
      {
        "t": 0.18,
        "rot": [0.0, 10.0, 0.0]
      },
      {
        "t": 0.3,
        "rot": [-3.0, -8.0, 0.0]
      },
      {
        "t": 0.4133,
        "rot": [-3.0, -14.0, 0.0]
      },
      {
        "t": 0.6333,
        "rot": [0.0, 0.0, 0.0]
      }
    ],
    "chest": [
      {
        "t": 0.0,
        "rot": [0.0, 0.0, 0.0]
      },
      {
        "t": 0.18,
        "rot": [2.0, 28.0, 0.0]
      },
      {
        "t": 0.3,
        "rot": [-4.0, -22.0, 0.0]
      },
      {
        "t": 0.4133,
        "rot": [-5.0, -34.0, 0.0]
      },
      {
        "t": 0.6333,
        "rot": [0.0, 0.0, 0.0]
      }
    ],
    "upper-arm-r": [
      {
        "t": 0.0,
        "rot": [0.0, 0.0, 6.0]
      },
      {
        "t": 0.09,
        "rot": [50.0, 20.0, 20.0]
      },
      {
        "t": 0.18,
        "rot": [80.0, 52.0, 14.0]
      },
      {
        "t": 0.3,
        "rot": [88.0, -8.0, 12.0]
      },
      {
        "t": 0.4133,
        "rot": [70.0, -48.0, 20.0]
      },
      {
        "t": 0.6333,
        "rot": [0.0, 0.0, 6.0]
      }
    ],
    "forearm-r": [
      {
        "t": 0.0,
        "rot": [8.0, 0.0, 0.0]
      },
      {
        "t": 0.18,
        "rot": [40.0, 0.0, 0.0]
      },
      {
        "t": 0.3,
        "rot": [12.0, 0.0, 0.0]
      },
      {
        "t": 0.4133,
        "rot": [10.0, 0.0, 0.0]
      },
      {
        "t": 0.6333,
        "rot": [8.0, 0.0, 0.0]
      }
    ],
    "upper-arm-l": [
      {
        "t": 0.0,
        "rot": [0.0, 0.0, -6.0]
      },
      {
        "t": 0.18,
        "rot": [10.0, 0.0, -30.0]
      },
      {
        "t": 0.3,
        "rot": [20.0, 0.0, -12.0]
      },
      {
        "t": 0.6333,
        "rot": [0.0, 0.0, -6.0]
      }
    ]
  }
}
