{
  "$schema": "../anim-clip.schema.json",
  "id": "anim-humanoid-hang",
  "rig": "greybox-humanoid",
  "loop": true,
  "duration": 1.6,
  "notes": "Grey-box placeholder (mw-e02.12): hanging from a ledge, both arms straight up to the edge, legs dangling with a slow sway; shimmying plays the same pose.",
  "tracks": {
    "spine": [
      {
        "t": 0,
        "rot": [5.0, 0, 0]
      }
    ],
    "upper-arm-l": [
      {
        "t": 0,
        "rot": [-172, 0, -8]
      }
    ],
    "upper-arm-r": [
      {
        "t": 0,
        "rot": [-172, 0, 8]
      }
    ],
    "forearm-l": [
      {
        "t": 0,
        "rot": [5, 0, 0]
      }
    ],
    "forearm-r": [
      {
        "t": 0,
        "rot": [5, 0, 0]
      }
    ],
    "thigh-l": [
      {
        "t": 0,
        "rot": [8, 0, 0]
      },
      {
        "t": 0.8,
        "rot": [-4, 0, 0]
      },
      {
        "t": 1.6,
        "rot": [8, 0, 0]
      }
    ],
    "thigh-r": [
      {
        "t": 0,
        "rot": [-4, 0, 0]
      },
      {
        "t": 0.8,
        "rot": [8, 0, 0]
      },
      {
        "t": 1.6,
        "rot": [-4, 0, 0]
      }
    ],
    "shin-l": [
      {
        "t": 0,
        "rot": [-10, 0, 0]
      }
    ],
    "shin-r": [
      {
        "t": 0,
        "rot": [-10, 0, 0]
      }
    ]
  }
}
