{
  "$schema": "../anim-clip.schema.json",
  "id": "anim-humanoid-run",
  "rig": "greybox-humanoid",
  "loop": true,
  "duration": 0.7,
  "notes": "Grey-box placeholder (mw-e02.20): a 4 m/s run cycle. Its root track (2.8 m forward per cycle) stands in for root translation found in a source clip: it is never applied (clips play in place) and only yields a velocity reference.",
  "tracks": {
    "spine": [
      {
        "t": 0,
        "rot": [10, 0, 0]
      }
    ],
    "thigh-l": [
      {
        "t": 0.0,
        "rot": [0.0, 0.0, 0.0]
      },
      {
        "t": 0.09,
        "rot": [28.28, 0.0, 0.0]
      },
      {
        "t": 0.17,
        "rot": [40.0, 0.0, 0.0]
      },
      {
        "t": 0.26,
        "rot": [28.28, 0.0, 0.0]
      },
      {
        "t": 0.35,
        "rot": [0.0, 0.0, 0.0]
      },
      {
        "t": 0.44,
        "rot": [-28.28, 0.0, 0.0]
      },
      {
        "t": 0.52,
        "rot": [-40.0, 0.0, 0.0]
      },
      {
        "t": 0.61,
        "rot": [-28.28, 0.0, 0.0]
      },
      {
        "t": 0.7,
        "rot": [0.0, 0.0, 0.0]
      }
    ],
    "thigh-r": [
      {
        "t": 0.0,
        "rot": [0.0, 0.0, 0.0]
      },
      {
        "t": 0.09,
        "rot": [-28.28, 0.0, 0.0]
      },
      {
        "t": 0.17,
        "rot": [-40.0, 0.0, 0.0]
      },
      {
        "t": 0.26,
        "rot": [-28.28, 0.0, 0.0]
      },
      {
        "t": 0.35,
        "rot": [0.0, 0.0, 0.0]
      },
      {
        "t": 0.44,
        "rot": [28.28, 0.0, 0.0]
      },
      {
        "t": 0.52,
        "rot": [40.0, 0.0, 0.0]
      },
      {
        "t": 0.61,
        "rot": [28.28, 0.0, 0.0]
      },
      {
        "t": 0.7,
        "rot": [0.0, 0.0, 0.0]
      }
    ],
    "shin-l": [
      {
        "t": 0.0,
        "rot": [-60.0, 0.0, 0.0]
      },
      {
        "t": 0.09,
        "rot": [-42.43, 0.0, 0.0]
      },
      {
        "t": 0.17,
        "rot": [0.0, 0.0, 0.0]
      },
      {
        "t": 0.26,
        "rot": [0.0, 0.0, 0.0]
      },
      {
        "t": 0.35,
        "rot": [0.0, 0.0, 0.0]
      },
      {
        "t": 0.44,
        "rot": [0.0, 0.0, 0.0]
      },
      {
        "t": 0.52,
        "rot": [0.0, 0.0, 0.0]
      },
      {
        "t": 0.61,
        "rot": [-42.43, 0.0, 0.0]
      },
      {
        "t": 0.7,
        "rot": [-60.0, 0.0, 0.0]
      }
    ],
    "shin-r": [
      {
        "t": 0.0,
        "rot": [0.0, 0.0, 0.0]
      },
      {
        "t": 0.09,
        "rot": [0.0, 0.0, 0.0]
      },
      {
        "t": 0.17,
        "rot": [0.0, 0.0, 0.0]
      },
      {
        "t": 0.26,
        "rot": [-42.43, 0.0, 0.0]
      },
      {
        "t": 0.35,
        "rot": [-60.0, 0.0, 0.0]
      },
      {
        "t": 0.44,
        "rot": [-42.43, 0.0, 0.0]
      },
      {
        "t": 0.52,
        "rot": [0.0, 0.0, 0.0]
      },
      {
        "t": 0.61,
        "rot": [0.0, 0.0, 0.0]
      },
      {
        "t": 0.7,
        "rot": [0.0, 0.0, 0.0]
      }
    ],
    "upper-arm-l": [
      {
        "t": 0.0,
        "rot": [0.0, 0.0, -6.0]
      },
      {
        "t": 0.09,
        "rot": [-24.75, 0.0, -6.0]
      },
      {
        "t": 0.17,
        "rot": [-35.0, 0.0, -6.0]
      },
      {
        "t": 0.26,
        "rot": [-24.75, 0.0, -6.0]
      },
      {
        "t": 0.35,
        "rot": [0.0, 0.0, -6.0]
      },
      {
        "t": 0.44,
        "rot": [24.75, 0.0, -6.0]
      },
      {
        "t": 0.52,
        "rot": [35.0, 0.0, -6.0]
      },
      {
        "t": 0.61,
        "rot": [24.75, 0.0, -6.0]
      },
      {
        "t": 0.7,
        "rot": [0.0, 0.0, -6.0]
      }
    ],
    "upper-arm-r": [
      {
        "t": 0.0,
        "rot": [0.0, 0.0, 6.0]
      },
      {
        "t": 0.09,
        "rot": [24.75, 0.0, 6.0]
      },
      {
        "t": 0.17,
        "rot": [35.0, 0.0, 6.0]
      },
      {
        "t": 0.26,
        "rot": [24.75, 0.0, 6.0]
      },
      {
        "t": 0.35,
        "rot": [0.0, 0.0, 6.0]
      },
      {
        "t": 0.44,
        "rot": [-24.75, 0.0, 6.0]
      },
      {
        "t": 0.52,
        "rot": [-35.0, 0.0, 6.0]
      },
      {
        "t": 0.61,
        "rot": [-24.75, 0.0, 6.0]
      },
      {
        "t": 0.7,
        "rot": [0.0, 0.0, 6.0]
      }
    ],
    "forearm-l": [
      {
        "t": 0,
        "rot": [20, 0, 0]
      }
    ],
    "forearm-r": [
      {
        "t": 0,
        "rot": [20, 0, 0]
      }
    ]
  },
  "root": [
    {
      "t": 0,
      "pos": [0, 0, 0]
    },
    {
      "t": 0.7,
      "pos": [0, 0, -2.8]
    }
  ],
  "markers": [
    {
      "kind": "footstep",
      "t": 0.17
    },
    {
      "kind": "footstep",
      "t": 0.52
    }
  ]
}
