{
  "$schema": "../anim-clip.schema.json",
  "id": "anim-humanoid-walk",
  "rig": "greybox-humanoid",
  "loop": true,
  "duration": 1,
  "notes": "Grey-box placeholder (mw-e02.20): a 1.5 m/s walk cycle, two steps per second. Footstep markers are alignment only; the sim emits footsteps from stride distance.",
  "tracks": {
    "spine": [
      {
        "t": 0,
        "rot": [-3.0, 0, 0]
      }
    ],
    "thigh-l": [
      {
        "t": 0.0,
        "rot": [0.0, 0.0, 0.0]
      },
      {
        "t": 0.12,
        "rot": [17.68, 0.0, 0.0]
      },
      {
        "t": 0.25,
        "rot": [25.0, 0.0, 0.0]
      },
      {
        "t": 0.38,
        "rot": [17.68, 0.0, 0.0]
      },
      {
        "t": 0.5,
        "rot": [0.0, 0.0, 0.0]
      },
      {
        "t": 0.62,
        "rot": [-17.68, 0.0, 0.0]
      },
      {
        "t": 0.75,
        "rot": [-25.0, 0.0, 0.0]
      },
      {
        "t": 0.88,
        "rot": [-17.68, 0.0, 0.0]
      },
      {
        "t": 1.0,
        "rot": [0.0, 0.0, 0.0]
      }
    ],
    "thigh-r": [
      {
        "t": 0.0,
        "rot": [0.0, 0.0, 0.0]
      },
      {
        "t": 0.12,
        "rot": [-17.68, 0.0, 0.0]
      },
      {
        "t": 0.25,
        "rot": [-25.0, 0.0, 0.0]
      },
      {
        "t": 0.38,
        "rot": [-17.68, 0.0, 0.0]
      },
      {
        "t": 0.5,
        "rot": [0.0, 0.0, 0.0]
      },
      {
        "t": 0.62,
        "rot": [17.68, 0.0, 0.0]
      },
      {
        "t": 0.75,
        "rot": [25.0, 0.0, 0.0]
      },
      {
        "t": 0.88,
        "rot": [17.68, 0.0, 0.0]
      },
      {
        "t": 1.0,
        "rot": [0.0, 0.0, 0.0]
      }
    ],
    "shin-l": [
      {
        "t": 0.0,
        "rot": [-30.0, 0.0, 0.0]
      },
      {
        "t": 0.12,
        "rot": [-21.21, 0.0, 0.0]
      },
      {
        "t": 0.25,
        "rot": [0.0, 0.0, 0.0]
      },
      {
        "t": 0.38,
        "rot": [0.0, 0.0, 0.0]
      },
      {
        "t": 0.5,
        "rot": [0.0, 0.0, 0.0]
      },
      {
        "t": 0.62,
        "rot": [0.0, 0.0, 0.0]
      },
      {
        "t": 0.75,
        "rot": [0.0, 0.0, 0.0]
      },
      {
        "t": 0.88,
        "rot": [-21.21, 0.0, 0.0]
      },
      {
        "t": 1.0,
        "rot": [-30.0, 0.0, 0.0]
      }
    ],
    "shin-r": [
      {
        "t": 0.0,
        "rot": [0.0, 0.0, 0.0]
      },
      {
        "t": 0.12,
        "rot": [0.0, 0.0, 0.0]
      },
      {
        "t": 0.25,
        "rot": [0.0, 0.0, 0.0]
      },
      {
        "t": 0.38,
        "rot": [-21.21, 0.0, 0.0]
      },
      {
        "t": 0.5,
        "rot": [-30.0, 0.0, 0.0]
      },
      {
        "t": 0.62,
        "rot": [-21.21, 0.0, 0.0]
      },
      {
        "t": 0.75,
        "rot": [0.0, 0.0, 0.0]
      },
      {
        "t": 0.88,
        "rot": [0.0, 0.0, 0.0]
      },
      {
        "t": 1.0,
        "rot": [0.0, 0.0, 0.0]
      }
    ],
    "upper-arm-l": [
      {
        "t": 0.0,
        "rot": [0.0, 0.0, -6.0]
      },
      {
        "t": 0.12,
        "rot": [-14.14, 0.0, -6.0]
      },
      {
        "t": 0.25,
        "rot": [-20.0, 0.0, -6.0]
      },
      {
        "t": 0.38,
        "rot": [-14.14, 0.0, -6.0]
      },
      {
        "t": 0.5,
        "rot": [0.0, 0.0, -6.0]
      },
      {
        "t": 0.62,
        "rot": [14.14, 0.0, -6.0]
      },
      {
        "t": 0.75,
        "rot": [20.0, 0.0, -6.0]
      },
      {
        "t": 0.88,
        "rot": [14.14, 0.0, -6.0]
      },
      {
        "t": 1.0,
        "rot": [0.0, 0.0, -6.0]
      }
    ],
    "upper-arm-r": [
      {
        "t": 0.0,
        "rot": [0.0, 0.0, 6.0]
      },
      {
        "t": 0.12,
        "rot": [14.14, 0.0, 6.0]
      },
      {
        "t": 0.25,
        "rot": [20.0, 0.0, 6.0]
      },
      {
        "t": 0.38,
        "rot": [14.14, 0.0, 6.0]
      },
      {
        "t": 0.5,
        "rot": [0.0, 0.0, 6.0]
      },
      {
        "t": 0.62,
        "rot": [-14.14, 0.0, 6.0]
      },
      {
        "t": 0.75,
        "rot": [-20.0, 0.0, 6.0]
      },
      {
        "t": 0.88,
        "rot": [-14.14, 0.0, 6.0]
      },
      {
        "t": 1.0,
        "rot": [0.0, 0.0, 6.0]
      }
    ],
    "forearm-l": [
      {
        "t": 0,
        "rot": [20, 0, 0]
      }
    ],
    "forearm-r": [
      {
        "t": 0,
        "rot": [20, 0, 0]
      }
    ]
  },
  "markers": [
    {
      "kind": "footstep",
      "t": 0.25
    },
    {
      "kind": "footstep",
      "t": 0.75
    }
  ]
}
