{
  "$schema": "../anim-clip.schema.json",
  "id": "anim-forgotten-brute-overhead",
  "rig": "greybox-humanoid",
  "notes": "The Forgotten brute's two-handed overhead (move forgotten-brute-overhead, 56/6/64 ticks). PLACEHOLDER (mw-ju8.19): the miner's overhead-chop clip retimed x2.333 so its hit marker lands on the move's first active tick (56); a bespoke clip is a follow-up.",
  "duration": 2.1,
  "markers": [
    {
      "kind": "hit",
      "t": 0.9333
    }
  ],
  "tracks": {
    "spine": [
      {
        "t": 0.0,
        "rot": [0.0, 0.0, 0.0]
      },
      {
        "t": 0.7,
        "rot": [6.0, -4.0, 0.0]
      },
      {
        "t": 0.9333,
        "rot": [-8.0, 0.0, 0.0]
      },
      {
        "t": 1.2833,
        "rot": [-9.6, 0.0, 0.0]
      },
      {
        "t": 2.1,
        "rot": [0.0, 0.0, 0.0]
      }
    ],
    "chest": [
      {
        "t": 0.0,
        "rot": [0.0, 0.0, 0.0]
      },
      {
        "t": 0.7,
        "rot": [12.0, -10.0, 0.0]
      },
      {
        "t": 0.9333,
        "rot": [-16.0, 6.0, 0.0]
      },
      {
        "t": 1.2833,
        "rot": [-17.6, 8.0, 0.0]
      },
      {
        "t": 2.1,
        "rot": [0.0, 0.0, 0.0]
      }
    ],
    "upper-arm-r": [
      {
        "t": 0.0,
        "rot": [0.0, 0.0, 6.0]
      },
      {
        "t": 0.35,
        "rot": [70.0, 0.0, 30.0]
      },
      {
        "t": 0.7,
        "rot": [150.0, -6.0, 16.0]
      },
      {
        "t": 0.9333,
        "rot": [92.0, -4.0, 8.0]
      },
      {
        "t": 1.2833,
        "rot": [40.0, 0.0, 4.0]
      },
      {
        "t": 2.1,
        "rot": [0.0, 0.0, 6.0]
      }
    ],
    "forearm-r": [
      {
        "t": 0.0,
        "rot": [8.0, 0.0, 0.0]
      },
      {
        "t": 0.35,
        "rot": [70.0, 0.0, 0.0]
      },
      {
        "t": 0.7,
        "rot": [105.0, 0.0, 0.0]
      },
      {
        "t": 0.9333,
        "rot": [10.0, 0.0, 0.0]
      },
      {
        "t": 2.1,
        "rot": [8.0, 0.0, 0.0]
      }
    ],
    "upper-arm-l": [
      {
        "t": 0.0,
        "rot": [0.0, 0.0, -6.0]
      },
      {
        "t": 0.35,
        "rot": [70.0, 0.0, -20.0]
      },
      {
        "t": 0.7,
        "rot": [140.0, 0.0, -14.0]
      },
      {
        "t": 0.9333,
        "rot": [70.0, 0.0, -10.0]
      },
      {
        "t": 1.2833,
        "rot": [30.0, 0.0, -8.0]
      },
      {
        "t": 2.1,
        "rot": [0.0, 0.0, -6.0]
      }
    ],
    "forearm-l": [
      {
        "t": 0.0,
        "rot": [20.0, 0.0, 0.0]
      },
      {
        "t": 0.7,
        "rot": [80.0, 0.0, 0.0]
      },
      {
        "t": 0.9333,
        "rot": [20.0, 0.0, 0.0]
      },
      {
        "t": 2.1,
        "rot": [20.0, 0.0, 0.0]
      }
    ]
  }
}
